id,code,description,name
civl-417,CIVL 417,"Linear wave theory; wave shoaling, refraction and diffraction; random waves; wave generation; long waves, tides and currents; coastal structures; beaches and coasts; mixing processes; harbour and marinas; coastal modelling. Credit will only be given for one of CIVL 417 or CIVL 540. [3-0-0] Prerequisite: CIVL 316 and one of EOSC 213, MATH 256. This course is not eligible for Credit/D/Fail grading.",Coastal Engineering
civl-418,CIVL 418,"Hydrologic processes - weather, precipitation, infiltration, evaporation, snowmelt and runoff generation. Emphasis on quantitative techniques including: hydrograph analysis, reservoir and channel routing, statistical methods and design floods, hydrologic modelling. [3-0-0] Prerequisite: CIVL 316. This course is not eligible for Credit/D/Fail grading.",Engineering Hydrology
civl-425,CIVL 425,Identification and evaluation of solutions to construction site operation problems: the relationship between design and construction; factors affecting productivity and safety; measurement of on-site performance. Credit will be granted for only one of CIVL 425 or CIVL 521. [3-0-0] Prerequisite: Fourth-year standing.,Case Studies of Construction Methods
civl-426,CIVL 426,"Building information modelling (BIM), 4D/5D modelling, design coordination, BIM execution and performance assessment, and integrated project delivery methods. Credit will be granted for only one of CIVL 426 or CIVL 526. This course is not eligible for Credit/D/Fail grading.",Virtual Design and Construction
civl-430,CIVL 430,"Non-linear response of reinforced concrete members subjected to axial load, bending and shear; design of simple one-way members including beams, columns, slabs and footings. [3-2*-1] Prerequisite: CIVL 231. This course is not eligible for Credit/D/Fail grading.",Design of Concrete Structures
civl-432,CIVL 432,"Design of steel structures to resist vertical and lateral loads. Floor and roof systems including conceptual layout, floor deck, beams, joists, trusses, and columns. Stability issues and limit states design. Connections and construction aspects. Seismic design. [3-0-0] Prerequisite: [CIVL331, CIVL332] This course is not eligible for Credit/D/Fail grading.",Advanced Structural Steel Design
civl-433,CIVL 433,"Design of members subjected to shear and torsion, long columns, two-way slab systems; seismic design of low-rise concrete buildings. [3-0-0] Prerequisite: [CIVL430] This course is not eligible for Credit/D/Fail grading.",Advanced Concrete Design
civl-435,CIVL 435,"Shear flow, shear deformation, St. Venant torsion, warping torsion, P-delta and geometric stiffness, buckling of columns and frames, cylindrical shells, beams on elastic foundation, shear wall analysis, elasto-plastic analysis. Introduction to the finite element method. [3-0-0] Prerequisite: CIVL 332. This course is not eligible for Credit/D/Fail grading.",Advanced Structural Analysis
civl-440,CIVL 440,Traffic operations and network analysis: macroscopic traffic models and shockwaves analysis; queueing theory and gaps; advanced signalized intersection analysis and design; freeway weaving and interchange analysis; data collection including field exercises. [3-0-0] Prerequisite: [CIVL340] This course is not eligible for Credit/D/Fail grading.,Transportation Engineering II
civl-445,CIVL 445,Integration and application of previously acquired knowledge and skills to find design solutions for a multi-disciplinary civil engineering project. Focus on conceptual and preliminary design. [2*-0-4] Prerequisite: CIVL_V 303 and fourth-year standing. This course is not eligible for Credit/D/Fail grading.,Civil Engineering Design Project I
civl-446,CIVL 446,Integration and application of previously acquired knowledge and skills to find design solutions for a multi-disciplinary civil engineering design project. Focus on detailed design. [2*-0-2] Prerequisite: CIVL 445. This course is not eligible for Credit/D/Fail grading.,Civil Engineering Design Project II
civl-478,CIVL 478,"Building science concepts associated with the design of modern buildings, focusing particularly on the building envelope's role in environmental separation, controlling the movement of heat, air, and water in liquid and vapour states. [3-0-0] Prerequisite: Fourth-year standing. This course is not eligible for Credit/D/Fail grading.",Building Science
civl-498,CIVL 498,Seminar or lecture. This course is not eligible for Credit/D/Fail grading.,Topics in Civil Engineering
cnps-312,CNPS 312,"Introduction to career education practices and standards program content, and principles for the design of career education programs. [3-0]",Career Education for Teachers
cnps-331,CNPS 331,A diversity of communication skills are essential when working in international contexts. The focus of this course is on developing specific skill sets for expanding effective communication competence in a diversity of contexts.,Communication Skills in Global Contexts
cnps-362,CNPS 362,Development of basic interviewing skills for counselling and guidance. [3-3],Basic Interviewing Skills
cnps-363,CNPS 363,Critical survey of career counselling theory and practice. [3-0],Career Counselling
cnps-364,CNPS 364,Examination of current theories and practices in family education and consultation. [3-0],Family Education and Consultation
cnps-365,CNPS 365,An overview of selected theories of counselling. [3-0],Introduction to Theories of Counselling
cnps-426,CNPS 426,This course is designed to assist the teacher in understanding and using guidance techniques for day-to-day use in the classroom. The emphasis will be on techniques for working with people towards better self-understanding and better perspectives of alternatives. [2-1],The Role of the Teacher in Guidance
cnps-427,CNPS 427,"The work of the beginning counsellor and guidance worker in assisting students with educational, vocational, and personal planning and decision-making. [3-0]",Guidance: Planning and Decision-making
cnps-433,CNPS 433,Personal and social adjustment issues for professional counsellors; basic skills necessary for effective group counselling. [3-3],The Personal and Social Development of the Adult
cnto-301,CNTO 301,"Elementary level (part I) course in Cantonese for non-heritage learners with no prior exposure to or background in Cantonese. Focus on training for basic listening and conversational skills in Cantonese. Heritage speakers of Mandarin are NOT eligible. Recommended pre-requisites: one of CHIN 107, CHIN 233, CHIN 108, CHIN 234, or placement approval. This course is not eligible for Credit/D/Fail grading.",Basic Cantonese I
cnto-303,CNTO 303,"Elementary level (part II) Cantonese for non-heritage learners. Continuation of CNTO 301. Focus on training for basic listening, conversational, and reading skills. Recommended pre-requisite: CNTO 301 or placement approval. This course is not eligible for Credit/D/Fail grading.",Basic Cantonese II
cnto-311,CNTO 311,"Basic oral and presentation skills in Cantonese. This is an accelerated course that covers content and topics similar to CNTO 301 and CNTO 303, but is structured specifically for heritage speakers of Mandarin. Recommended pre-requisites: one of CHIN 243, CHIN 244, or placement approval. This course is not eligible for Credit/D/Fail grading.",Basic Cantonese for Mandarin Speakers
cnto-401,CNTO 401,"Intermediate lower level (part I) Cantonese for non-heritage learners. Recommended pre-requisites: One of CNTO 303, CNTO 311, or placement approval. This course is not eligible for Credit/D/Fail grading.",Intermediate Cantonese I
cnto-403,CNTO 403,Intermediate lower level (part II) Cantonese for non-heritage learners. Continuation of CNTO 401. Recommended pre-requisite: CNTO 401 or placement approval. This course is not eligible for Credit/D/Fail grading.,Intermediate Cantonese II
cnto-451,CNTO 451,"Popular culture in Hong Kong from media such as television, cinema, popular music, literature, social media, etc., through advanced authentic Cantonese listening and reading materials. Open to non-heritage and heritage speakers of Mandarin and/or Cantonese. Recommended pre-requisite: CNTO 401. Prior to registration, a minimum of 9 credits of 300-level ASIA coursework is strongly recommended. This course is not eligible for Credit/D/Fail grading.",Advanced Cantonese through Popular Culture
coec-293,COEC 293,Construction and interpretation of financial reports prepared primarily for external use. Credit will be granted for only one of COEC 293 or COMM 293. Equivalency: COMM293 This course is not eligible for Credit/D/Fail grading.,Financial Accounting
coec-370,COEC 370,"Corporate enterprise decisions including capital budgeting; capital structure choice; and financial policies, tools, and valuation. Credit will be granted for only one of COEC 370 or COMM 370. Prerequisite: Either (a) all of ECON 315, ECON 316 or (b) ECON 308. Equivalency: COMM370 This course is not eligible for Credit/D/Fail grading.",Corporate Finance
coec-371,COEC 371,"Basic concepts of finance, including security valuation, security markets, and financial decisions concerning risk and return. Credit will be granted for only one of COEC 371 or COMM 371. Prerequisite: Either (a) ECON 308 or (b) all of ECON 315, ECON 316. Equivalency: COMM371 This course is not eligible for Credit/D/Fail grading.",Investment Theory
coec-437,COEC 437,"Theory and technology of database management from an applications perspective; database design; database administration. Credit will be granted for only one of COEC 437, COMM 437, or CPSC 304. Equivalency: COMM 437 This course is not eligible for Credit/D/Fail grading.",Database Technology
coec-475,COEC 475,"Economic analysis of environmental problems, energy systems, and natural resources. Policy options to help resolve these issues. Credit will be granted for only one of COEC 475, COMM 487, COMM 597, or ECON 371. Prerequisite: ECON 315 and one of ECON 316, ECON 308.","The Economics & Policy of the Environment, Energy, and Natural Resources"
cogs-200,COGS 200,"Interdisciplinary examination of human mental processes and how these are mediated by the brain. Will draw on cognitive psychology, linguistics, cognitive neuroscience, philosophy, artificial intelligence. [3-0-0] Prerequisite: 2nd-year class standing or higher in the Faculty of Arts or Science.",Introduction to Cognitive Systems
cogs-300,COGS 300,Theory and methods for integrating diverse disciplinary content in cognitive systems. [3-2-0] Prerequisite: COGS 200. And 3 credits of CPSC.,Understanding and Designing Cognitive Systems
cogs-303,COGS 303,Examination and comparison of the research methodologies of different disciplines relevant to cognitive systems. [3-0-0] Prerequisite: COGS 200.,Research Methods in Cognitive Systems
cogs-401,COGS 401,"Interdisciplinary seminar integrating theory, methods, and current research topics. [1-0-4] Prerequisite: COGS 300.",Seminar in Cognitive Systems
cogs-402,COGS 402,Supervised research project in a Cognitive Systems-related laboratory. [0-9-0] Prerequisite: COGS 300. COGS 401 is recommended.,Research in Cognitive Systems
comm-100,COMM 100,An overview of all functional areas of business. Students will be introduced to the computer and internet tools commonly used in business. For non-Commerce students only. Credit will be granted for only one of COMM 100 or COMR 100. Equivalency: COMR 100,Introduction to Business
comm-101,COMM 101,The different disciplines of business and their combination in management planning and decision-making. This course is not eligible for Credit/D/Fail grading.,Business Fundamentals
comm-105,COMM 105,"An introduction to the roles and responsibilities of business at individual, organizational, and societal levels. Students will examine their personal values and lay the foundation for ongoing, active exploration of career paths through which they can achieve their goals. This course is not eligible for Credit/D/Fail grading.","Values, Ethics, and Community"
comm-120,COMM 120,A broad introduction to the field of business and how the different disciplines within business interact and combine in business decision-making. For Master of Management - Dual Degree Option students only. This course is not eligible for Credit/D/Fail grading.,Business Immersion
comm-190,COMM 190,"Introduction to decision models in business, including basic optimization, linear programming, probability, decision analysis, random variables, simulation, and solving decision problems using spreadsheet tools. Credit will be granted for only one of COMM 190, COMM 290, ECON 325, ECON 327, PSYC 366, STAT 241, or STAT 251. Corequisite: One of MATH 100, MATH 102, MATH 104, MATH 110, MATH 120, MATH 180, MATH 184. Equivalency: COMM290. This course is not eligible for Credit/D/Fail grading.",Introduction to Quantitative Decision Making
comm-191,COMM 191,"Methods and applications of statistics in business; data analysis, descriptive regression; data generation; sampling distributions; hypothesis testing; confidence intervals; two sample problems; inference in regression. Credit will be granted for only one of COMM 191, BIOL 300, COMM 291, ECON 226, ECON 325, ECON 327, EPSE 482, FRST 231, GEOG 374, KIN 371, PSYC 218, PSYC 278, PSYC 366, POLI 380, SOCI 328, STAT 200, or STAT 203. Prerequisite: One of COMM 190, COMM 290. Equivalency: COMM291. This course is not eligible for Credit/D/Fail grading.",Application of Statistics in Business
comm-192,COMM 192,"Behaviour in organizations as it affects people as individuals, their relationships with others, their performance in groups and their effectiveness at work. Credit will be granted for only one of COMM 192, COMM 292, COMM 321, COMM 329, or COMR 329. Equivalency: COMM 292. This course is not eligible for Credit/D/Fail grading.",Management and Organizational Behaviour
comm-196,COMM 196,An activity-focused course providing the opportunity to study and practice forms of written and non-written communication needed in business. Credit will be granted for only one of COMM 196 or COMM 395. This course is not eligible for Credit/D/Fail grading.,Business Communications I
comm-202,COMM 202,"Fundamentals of career management including effective resume and cover letter writing, performing well in interviews and learning about the recruiting cycles, networking and resources available at the Hari B. Varshney Business Career Centre. This course is not eligible for Credit/D/Fail grading.",Career Fundamentals
comm-203,COMM 203,"The role of employment relations in enterprise performance. Managing employees under statutory law, collective bargaining, and progressive human resource management. Key issues in forming, developing, and maintaining a work force. Prerequisite: One of COMM 192, COMM 292 and either (a) all of ECON 101, ECON 102 or (b) ECON 100. This course is not eligible for Credit/D/Fail grading.",Managing the Employment Relationship
comm-204,COMM 204,"The design and management of systems to make products, provide services and deliver them to the end user. Credit will be granted for only one of COMM 204, COMM 398, or COMR 398. Prerequisite: One of COMM 190, COMM 290 and one of COMM 191, COMM 291. This course is not eligible for Credit/D/Fail grading.",Logistics and Operations Management
comm-205,COMM 205,Overview of computer technology and terminology; use of computers as managerial and administrative tools; the management of computer resources and the influence of information technology within the organization. This course is not eligible for Credit/D/Fail grading.,Introduction to Management Information Systems
comm-220,COMM 220,An experiential course covering a broad range of business writing and communications. For Master of Management - Dual Degree Option students only. This course is not eligible for Credit/D/Fail grading.,Business Communications
comm-271,COMM 271,Roles of capital market institutions and participants. Skill development for basic financial principles in the quantitative and qualitative evaluation of bond and stock investments. This course is not eligible for Credit/D/Fail grading.,Introduction to Capital Markets
comm-280,COMM 280,"Entrepreneurial essentials from creating viable opportunities through building a founding team, strategic planning, going to market, fleshing out an organization and planning the future of the business. Credit will be granted for only one of COMM 280 or COMR 280. Equivalency: COMR280",Entrepreneurship
comm-293,COMM 293,"Introduction to the construction and interpretation of financial reports prepared primarily for external use. Credit will be granted for only one of COMM 293, COEC 293, or COMM 320. Prerequisite: One of MATH 100, MATH 102, MATH 104, MATH 110, MATH 120, MATH 180, MATH 184. Equivalency: COEC293. This course is not eligible for Credit/D/Fail grading.",Financial Accounting
comm-294,COMM 294,"Introduction to the development and use of accounting information for management planning and control and the development of cost information for financial reports. Credit will be granted for only one of COMM 294 or COEC 294. Prerequisite: One of COEC 293, COMM 293. Equivalency: COEC 294. This course is not eligible for Credit/D/Fail grading.",Managerial Accounting
comm-295,COMM 295,"Economic foundations of managerial decision-making. Demand theory, cost and production, market structure, competitive strategy, organization of the firm, welfare-economic foundations of business regulation. Credit will be granted for only one of ECON 201, ECON 206, ECON 301, ECON 304, FRE 295 or COMM 295. Prerequisite: Either (a) ECON 100 or (b) all of ECON 101, ECON 102. This course is not eligible for Credit/D/Fail grading.",Managerial Economics
comm-296,COMM 296,"Basic considerations affecting the domestic and international marketing of goods and services. Credit will be granted for only one of COMM 296, COMM 420, COMM 465, or COMR 465. Corequisite: COMM 293 and one of COMM 295, ECON 201, ECON 301. This course is not eligible for Credit/D/Fail grading.",Introduction to Marketing
comm-298,COMM 298,"Introduces the basic principles of financial valuation, including the time-value of money and the risk/return tradeoff. Develops tools for the quantitative analysis of corporate and/or individual financing and saving decisions, and of capital budgeting decisions. Credit will be granted for only one of COMM 298, COEC 298, COMM 421, COMM 473, or COMR 473. [3-0-0] Corequisite: COMM 293 and one of COMM 190, COMM 290 and one of COMM 295, ECON 301. Equivalency: COEC298. This course is not eligible for Credit/D/Fail grading.",Introduction to Finance
comm-306,COMM 306,"Examines economic factors affecting the urban land market, with an emphasis on determinants of urban land values, the housing market, urban transportation, and land use policies. Prerequisite: One of COMM 295, ECON 201, ECON 301. This course is not eligible for Credit/D/Fail grading.",Urban Land Economics
comm-307,COMM 307,"Evaluation of investment in real estate assets; proforma analysis, property and asset management, equity securitization, appraisal, and international real estate investment. Prerequisite: One of COMM 295, ECON 201, ECON 301 and one of COMM 297, COMM 298. This course is not eligible for Credit/D/Fail grading.",Real Estate Investment
comm-310,COMM 310,"Computer simulation, simulation languages. Typical business applications in financial planning, waiting line problems and other operating problems. Prerequisite: One of COMM 191, COMM 291.",Simulation Models in Business Decision-Making
comm-311,COMM 311,"Social science research: theory, research design, methods, and criticism. For students in the Commerce Scholars Program only. This course is not eligible for Credit/D/Fail grading.",Research Theory for Commerce Scholars
comm-312,COMM 312,"Skill Development for leading organizations while better managing for values. Recognizing organizational values, and developing concrete plans for better delivering on these values. This course is not eligible for Credit/D/Fail grading.",Business Ethics Leadership
comm-314,COMM 314,"Tools to apply sustainable and responsible decision making through individual, organizational, and structural lenses. Topics include diversity and group think, the circular economy, and climate change adaptation. This course is not eligible for Credit/D/Fail grading.",Strategies for Responsible Business
comm-320,COMM 320,Preparation of financial statements and use of financial information contained in financial statements to make better decisions. For Master of Management - Dual Degree Option students only. This course is not eligible for Credit/D/Fail grading.,Foundations in Accounting I
comm-321,COMM 321,Effects of individual and group behaviour on organizational processes and outcomes. Application of relevant frameworks from the social sciences to particular organizational situations. For Master of Management - Dual Degree Option students only. This course is not eligible for Credit/D/Fail grading.,Organizational Behaviour
comm-323,COMM 323,"Topics in diversity related to identity, group categorization, stereotyping, explicit and implicit bias, microaggressions, and discrimination. Mitigation of institutional inequality and discrimination through inclusive leadership and critical analysis of organizational practices and policies. Prerequisite: COMM 203. This course is not eligible for Credit/D/Fail grading.","Leading Diversity, Equity and Inclusion in Organizations"
comm-324,COMM 324,"Application of descriptive and inferential statistics to decisions in core Human Resources (HR) areas, including recruitment, selection, compensation, training, and performance management using organizations. HR data and human capital metrics. Machine learning and AI in strategic HR decision making. Prerequisite: All of COMM 203, COMM 191, COMM 205. This course is not eligible for Credit/D/Fail grading.",People Analytics
comm-335,COMM 335,"Introduction to information technology related to business use. Design, implementation and application of Information Systems. Prerequisite: One of COMM 205, CPSC 210. This course is not eligible for Credit/D/Fail grading.",Information Systems Technology and Development
comm-336,COMM 336,"Business fundamentals in the digital economy: leveraging digitization and automation; data and analytics; platforms; crowdsourcing; understanding the impact of digital technologies on firms, markets, economies as well as individuals and society. Prerequisite: COMM 205. This course is not eligible for Credit/D/Fail grading.",Introduction to Digital Business
comm-337,COMM 337,Introduction to object-oriented computer programming; computational thinking; program design; scripting; documentation techniques; file handling; database access; and web crawling techniques. Students will apply data structures and programming constructs to the development of business analytics and other related applications. Credit will be granted for only one of COMM 337 and CPSC 103. Prerequisite: COMM 205. This course is not eligible for Credit/D/Fail grading.,Business Programming and Analytics
comm-338,COMM 338,Fundamentals of cybersecurity from managerial perspectives; Cyber risk management and governance; Security architecture and design; Capabilities to protect enterprise assets and respond to cyber incidents. Prerequisite: COMM 205 or CPSC 213 or CPEN 212. This course is not eligible for Credit/D/Fail grading.,Management of Cybersecurity
comm-349,COMM 349,"Overview of the characteristics and commercial environment of logistics and transportation services; service operations planning and design, costing, pricing and quality management. Corequisite: One of COMM 204, COMM 296. This course is not eligible for Credit/D/Fail grading.",Logistics Services Management
comm-353,COMM 353,"An examination of accounting as a means of measurement and as an information system for external reporting purposes. Prerequisite: All of COMM 293, COMM 294. Corequisite: Either (a) all of COMM 297, COMM 397 or (b) COMM 298. This course is not eligible for Credit/D/Fail grading.",Financial Accounting - Intermediate I
comm-354,COMM 354,"The provision and analysis of cost accounting information that will assist management in making operating decisions and in evaluating operational performance. The utilization of statistical analysis and linear models is included. Prerequisite: All of COMM 293, COMM 294 and one of COMM 190, COMM 290 and one of COMM 191, COMM 291. This course is not eligible for Credit/D/Fail grading.",Cost Accounting
comm-355,COMM 355,"A study of income tax from the standpoint of the individual and of business enterprise. Prerequisite: COMM 293, COMM 457. This course is not eligible for Credit/D/Fail grading.",Income Taxation
comm-362,COMM 362,"The use of consumer research and theory in marketing and policy decisions. Psychological, sociological and economic theory and research relevant to consumer behaviour are considered. Prerequisite: COMM 296. This course is not eligible for Credit/D/Fail grading.",Consumer Behaviour
comm-363,COMM 363,"Analytical methods applicable to marketing management decision making; attention to strategic considerations linking analysis of consumer data, corporate data, environmental factors, and competitive response. The course makes extensive use of micro computers. Prerequisite: COMM 296. This course is not eligible for Credit/D/Fail grading.",Marketing Analysis
comm-365,COMM 365,"The process of marketing research including topics such as problem/opportunity formulation, research objectives, data sources, research instrument design, sampling, data collection and processing and methods of data analysis. Prerequisite: COMM 296 and one of COMM 190, COMM 290 and one of COMM 191, COMM 291 and one of COMM 295, ECON 201, ECON 301. Corequisite: COMM 205. This course is not eligible for Credit/D/Fail grading.",Market Research
