id,code,description,name
hist-425,HIST 425,"Continuity and change in the relations of war and society, the connections between the economy, society, the military, and government in peacetime as well as war; not a course in military history.",War and Society
hist-432,HIST 432,"Note: This course does not appear in the first dataset provided; however, it may be related to HIST 360 or HIST 361 based on title similarity. HIST 360: ""International Relations, 1900-1945"" and HIST 361: ""International Relations Since 1945"" have credit exclusions with HIST 432. Assuming HIST 432 is a combined or variant form, a synthesized description follows: The evolution of the contemporary international system from 1900 to the present, covering pre-WWII and post-1945 periods. Credit will be granted for only one of HIST 360, HIST 361, or HIST 432.",International Relations in the Twentieth Century
hist-464,HIST 464,An interdisciplinary history of early European contact with the Indigenous peoples of the northwest coast of North America and the Pacific Islands.,First Contacts in the Pacific
hist-484,HIST 484,"Confucian societies are often thought of as ones in which the brush is mightier than the sword. In fact the military has been a crucial factor in East Asia, and warfare has been the engine which has driven many of the most significant changes in East Asian history. This course will look at the evolution of East Asian military systems, and at the impact of recurrent warfare on East Asia societies.",East Asian Military systems and warfare China
hist-490,HIST 490,Selected problems in the theory and practice of historical work. Check with the department for course offerings. Restricted to fourth year students majoring in History or in the History and Philosophy of Science. Also open to History Honours students. This course is not eligible for Credit/D/Fail grading.,Seminar for Majors in History
ital-101,ITAL 101,"Introduction to the essentials of Italian vocabulary, expressions, grammar and cultural life. Focus on listening, reading, speaking and writing skills in everyday situations in the present tense. Aligned with CEFR level A1 objectives. Credits will be only granted for ITAL 103 or both ITAL 101, ITAL 102.",Beginners' Italian I
ital-102,ITAL 102,"Continuation of foundational elements of Italian language. Development of listening, reading, speaking and writing skills in the context of everyday situations in the present and past tenses. Aligned with CEFR level A1 objectives. Credits will be only granted for ITAL 103 or both ITAL 101, ITAL 102. Recommended pre-requisite: ITAL 101.",Beginners' Italian II
ital-201,ITAL 201,"Introduction to complex language structures used to communicate in a variety of situations by using different tenses and modes. Enhanced ability to comprehend, interact and express wishes or feelings in common personal and social contexts. Aligned with CEFR level A2 objectives. Recommended pre-requisite: ITAL 102 or successful completion of CEFR Level A1.",Elementary Italian I
ital-202,ITAL 202,"Expansion of fundamental notions and presentation of elaborate structures, present, past and future tenses and different modes. Enriched opportunities to explore Italian culture and develop intercultural skills. Aligned with CEFR level A2 objectives. Recommended pre-requisite: ITAL 201.",Elementary Italian II
japn-100,JAPN 100,An introduction to modern spoken and written Japanese with emphasis on both form (grammar and syntax) and functions (Non-intensive). Not available for credit to students with JAPN 11 and/or JAPN 12. Credit will be granted for only one of JAPN 100 or JAPN 160.,Beginning Japanese IA
japn-101,JAPN 101,Continuation of JAPN 100 (Non-intensive). Not available for credit to students with JAPN 12. Credit will be granted for only one of JAPN 101 or JAPN 160. Recommended pre-requisite: JAPN 100.,Beginning Japanese IB
japn-200,JAPN 200,"Continuation of JAPN 101 (Non-intensive). Credit will be granted for only one of JAPN 200 or JAPN 102 or JAPN 260. Recommended pre-requisite: one of JAPN 101, JAPN 150, JAPN 160.",Beginning Japanese II A
japn-201,JAPN 201,"Continuation of JAPN 200 (Non-intensive). Credit will be granted for only one of JAPN 201 or JAPN 103 or JAPN 260. Recommended pre-requisites: one of JAPN 102, JAPN 200.",Beginning Japanese II B
japn-320,JAPN 320,"Integrated coverage of topics on culture and cross-cultural communication designed to develop competencies in speaking, listening, reading, and writing. It is strongly recommended that JAPN 320 and JAPN 321 be taken in the same year. Credit will be granted for only one of JAPN 320 or JAPN 210 or JAPN 360. Recommended pre-requisites: one of JAPN 103, JAPN 151, JAPN 201, JAPN 260.",Intermediate Japanese I A
japn-321,JAPN 321,"Continuation of JAPN 320. It is strongly recommended that JAPN 320 and JAPN 321 be taken in the same year. Credit will be granted for only one of JAPN 321 or JAPN 211 or JAPN 360. Recommended pre-requisites: one of JAPN 210, JAPN 320.",Intermediate Japanese I B
kin-110,KIN 110,"Structure of the neural, muscular, and skeletal systems of the human body. Special emphasis on movement analysis and the physiological effects of exercise.",Human Anatomy
kin-120,KIN 120,"Role of physical activity in the maintenance of a healthy life. Application of basic physical fitness and exercise methods, exercise techniques and fitness appraisal.",Health and Exercise Management
kin-131,KIN 131,"Structure and function of the skeletal system, muscular system, integumentary system, neuro-hormonal control, and endocrinology. Emphasis on the integrative nature of the systems discussed.",Systems Physiology I
kin-132,KIN 132,"Structure and function of the cardiovascular system, respiratory system, urinary system, digestive system, and immune system. Emphasis on the integrative nature of the systems discussed.",Systems Physiology II
kin-140,KIN 140,"A lifespan approach to motor development that examines underlying factors affecting physical growth, physical activity behaviour, and human motor performance, while highlighting contemporary issues and trends in society.",Lifespan Motor Development
kin-150,KIN 150,Psychological theories and research related to sport and exercise behaviour.,Sport and Exercise Psychology
kin-160,KIN 160,"Introduction to the political, economic, and social basis of leisure and sport; concepts, theories, and problems.",Leisure and Sport in Society
kin-205,KIN 205,Critical evaluation of research studies and methods with emphasis on the physical activity context. Prerequisite: Second-year standing or higher.,Research Methods in Kinesiology
kin-206,KIN 206,"Basic concepts and principles of descriptive and inferential statistics, and distribution-free statistical techniques. Prerequisite: Second-year standing or higher.",Introduction to Statistics in Kinesiology
kin-211,KIN 211,"Processes underlying human movement and learning motor skills and factors influencing acquisition, performance, and movement control. Prerequisite: All of KIN 110, KIN 131.",Human Motor Behaviour I
kin-216,KIN 216,"Application of elementary principles of physics and math to a quantitative analysis of movement. Analysis will also focus on the development of forces within muscles and their effect on initiating and controlling human movement. Prerequisite: All of KIN 110, KIN 131.",Biomechanics I
kin-232,KIN 232,"Study of nutrition and its application to physical activity and health. Macro- and micronutrient classification and recommended daily intakes, their digestion, functions in the body, and their role in supporting physical activity and health will be discussed. Prerequisite: All of KIN 131, KIN 132.","Nutrition, Physical Activity, and Health"
kin-235,KIN 235,"Acute and chronic effects of exercise on body systems; basic concepts of cardiovascular, respiratory, and muscular responses to physical activity. Prerequisite: All of KIN 110, KIN 120, KIN 131, KIN 132.",Exercise Physiology I
kin-262,KIN 262,Health policy and the social context in relation to active health. Prerequisite: KIN 160.,Health Policy and Society
kin-300,KIN 300,An exploration of human movement and related issues pertaining to sports and athletic performance. Restricted to non-B.Kin. students only. Not for credit in the B.Kin. Program. Prerequisite: Second-year standing.,Human Athletic Performance
kin-310,KIN 310,"The musculoskeletal structures and neural innervations involved in the control of human movement. Attention will be given to the practical application of human anatomy as it pertains to clinical, athletic, or everyday situations. Prerequisite: Third-year standing. Restricted to students in the BHK and BKIN programs.",Human Functional Musculoskeletal Anatomy
kin-311,KIN 311,"Processes and mechanisms involved in the sensory, perceptual, and cognitive contributions to human movements. Prerequisite: All of KIN 110, KIN 131, KIN 211, KIN 216.",Sensorimotor Control of Human Movement
kin-313,KIN 313,"The neurophysiological and functional neuroanatomical processes involved in the sensory and motor control of movement, posture, and balance in the human. Peripheral and central sensorimotor structures, and neurological diseases that affect human movement and balance control will be discussed. Prerequisite: All of KIN 110, KIN 131.",Neuromuscular Integration of Human Movement
kin-316,KIN 316,"Mechanics of muscular contraction and how the mechanical properties of the muscle, ligaments, tendons, and bone work synergistically. Prerequisite: All of KIN 110, KIN 131, KIN 211, KIN 216.",Biomechanical Properties of Tissues
kin-320,KIN 320,"Conditioning methods, exercise techniques, and appraisal methods for fitness in physical activity and sport. Prerequisite: All of KIN 110, KIN 120, KIN 205, KIN 206.",Exercise Testing and Prescription
kin-335,KIN 335,"Explore how the cardiovascular and respiratory systems are regulated and integrated during exercise. Prerequisite: All of KIN 110, KIN 120, KIN 131, KIN 132, KIN 235.",Advanced Applications of Exercise Physiology
kin-342,KIN 342,The pedagogical skills and knowledge required to design and implement developmentally appropriate physical activities learning environments in a variety of settings. Prerequisite: One of KIN 140.,"Creating Effective, Developmentally Appropriate, Physical Activity Learning Environments"
kin-344,KIN 344,"Policy issues relating to leisure opportunities for persons with disabilities. Prerequisite: All of KIN 160, KIN 262.",Leisure Services for Persons with a Disability
kin-345,KIN 345,"Methods of athletic conditioning, planning the program, psychology of training and coaching, athletic evaluation. Prerequisite: KIN 150.",Foundations of Coaching
kin-351,KIN 351,"Physical activity counselling, education programming principles, exercise considerations, and strategies for promoting inclusive physical activity for people with disabilities. Prerequisite: KIN 150 and Third-year standing.",Physical Activity and Disability
kin-353,KIN 353,"Exploring concepts, principles, and theories as they relate to the practice of promoting and supporting recommended physical activity for individuals and population groups. Particular attention will be directed at contemporary issues, controversies, evidence-informed initiatives, and innovative new approaches. Prerequisite: KIN 150 and third-year standing.",Current Topics in Exercise and Health Psychology
kin-355,KIN 355,"The design and implementation of movement experiences for children in early childhood years. Prerequisite: All of KIN 110, KIN 131, KIN 140, KIN 150, KIN 160, KIN 211.",Movement Experiences for Young Children
kin-360,KIN 360,"Relationships that sport and leisure have with peace, conflict, and social inequality in Canada and internationally. Prerequisite: KIN 160.","Sport, Peace, and Conflict"
kin-363,KIN 363,Selected aspects of leisure and sport examined in relation to modern social structures and cultures. Prerequisite: KIN 160.,"Leisure, Sport and Popular Culture"
kin-364,KIN 364,"Examination of the Modern Olympic Games as an event with important political, economic, environmental, and cultural ramifications. Prerequisite: Third-year standing.","The Modern Olympics: Power, Politics, and Performance"
kin-368,KIN 368,"Historical and contemporary issues in Canada that shape Indigenous sport and physical activity, health programs, and policies. Prerequisite: All of KIN 160, KIN 262.",Indigenous Sport and Physical Culture in Settler Canada
kin-411,KIN 411,"Neuroanatomy of human motion in healthy and clinical populations. Prerequisite: All of KIN 110, KIN 131, KIN 211, KIN 216.",Neuroanatomy of Human Movement
kin-413,KIN 413,"Examining the sensory, motor, and biomechanical factors that contribute to human balance control during quiet standing and postural reactions to internal and external perturbations. Emphasis on understanding the characteristics of healthy balance control and changes associated with age and disease. Prerequisite: All of KIN 110, KIN 131, KIN 211, KIN 216, and third-year standing.",Sensori-Motor Control of Human Balance
kin-415,KIN 415,"Concepts in neuroplasticity related to sensori-motor control of movement and exercise. The focus will be on plasticity (both adaptive and maladaptive) that arises because of either training or injury/non-use as it relates to movement control and exercise. Prerequisite: All of KIN 110, KIN 131, and third-year standing.",Sensori-motor Neuroplasticity in Movement and Exercise
kin-419,KIN 419,"Integration and application of laboratory principles and techniques for experimental investigations of topics in neuromechanical kinesiology, including biomechanics, motor behaviour, and neurophysiology. Prerequisite: All of KIN 110, KIN 131, KIN 211, KIN 216.",Laboratory Investigations in Neuromechanical Kinesiology
kin-420,KIN 420,Training and safety strategies for the prevention of injuries to the musculoskeletal system and sense organs. Prerequisite: KIN 110.,Prevention of Sports Injuries
kin-424,KIN 424,"Training and safety strategies for the management and prevention of disorders of internal organs and central nervous system. Topics include environmental and nutritional factors in conditioning and pre-event preparation. Prerequisite: All of KIN 110, KIN 131.",Medical Aspects of Sport and Exercise
kin-432,KIN 432,"Sport nutrition guidelines, physiological mechanisms of fuel use in the body, nutritional strategies to support weight change, hydration, and ergogenic aids the needs of special athlete populations. Prerequisite: All of KIN 131, KIN 132, KIN 232.",Sport Nutrition
kin-434,KIN 434,"Exploring the physiological and biochemical changes that occur in skeletal muscle, adipose tissue, and liver following exercise. Interactions between exercise, nutrition, and commonly prescribed medications used for the treatment of diabetes and cardiovascular disease will also be examined. Prerequisite: All of KIN 232, KIN 235, and third-year standing.","Exercise, Nutrition, and Metabolism"
kin-435,KIN 435,"Operation of the lungs, chest wall, and ventilatory control mechanisms during dynamic whole-body exercise. Prerequisite: All of KIN 110, KIN 120, KIN 131, KIN 132, KIN 235, KIN 335.",Pulmonary Physiology of Exercise
kin-438,KIN 438,"Cellular and molecular mechanisms of muscle adaptability to aerobic and resistance training, inactive and aging: signaling cascades controlling hypertrophy and atrophy, satellite cell contribution to muscle repair, and mitochondrial/ribosomal biogenesis. BIOL 112 or similar recommended. Prerequisite: All of KIN 110, KIN 120, KIN 131, KIN 132, KIN 235, KIN 335.","Skeletal Muscle Physiology: Molecular Adaptations to Training, Disuse and Aging"
kin-442,KIN 442,"Processes, techniques, and considerations in the planning, implementation, and evaluation of physical education, sport, and exercise programs in both public and private agencies. Prerequisite: All of KIN 140, KIN 262, and Third-year standing.","Planning Physical Education, Sport and Exercise Programs"
kin-444,KIN 444,"Examination of innovative, developmentally appropriate, conceptual and tactical approaches to team game instruction. Prerequisite: One of KIN 140.",Exploring Alternative Methods for Teaching Games and Sports
kin-450,KIN 450,"Examination of the psychological and behavioural processes of athletes from a social justice perspective. The focus will be on the role of social structures, sociocultural norms, power relations, and social identities in shaping athletes' perceptions and lived experiences in sport. Prerequisite: All of KIN 150, KIN 160, and third-year standing.",Inclusive Approaches to Sport Psychology
kin-453,KIN 453,"Examining the influence of psychological factors across different settings and populations, with a particular focus on interventions aimed at enhancing mental health. Understanding psychology can be used to design effective interventions at the individual and community level. Prerequisite: KIN 150.",Understanding and Changing Physical Activity Behaviour
kin-459,KIN 459,"Exploration of the role of physical activity and exercise on brain health, mental health, and underpinning psychological and biological mechanisms. This course deepens students' capacity to read and interpret scientific evidence. Prerequisite: All of KIN 150, KIN 205, KIN 206.",Psychobiology of Physical Activity
kin-460,KIN 460,"Examination of current issues in the sociology of aging and health. Prerequisite: All of KIN 160, KIN 262.","Aging, Health, and Society"
kin-464,KIN 464,"Current perspectives on health promotion and health education; design and implementation of health promotion strategies in a variety of arenas, particularly health promotion/education strategies aimed at encouraging physical activity. Prerequisite: All of KIN 150, KIN 160, KIN 205, KIN 262.",Health Promotion and Physical Activity
kin-465,KIN 465,"Examination of multiculturalism and interculturalism in the delivery of community-based physical activities for diverse populations; connections between physical activity and health in different cultural contexts. Community service learning and participation in culturally unfamiliar physical activities are core elements. Prerequisite: All of KIN 160, KIN 262.","Interculturalism, Health and Physical Activity"
kin-468,KIN 468,"The complex social, cultural, historical, and economic factors that shape health and wellness within Indigenous communities will be explored through extensive blended learning and experiential learning opportunities. Prerequisite: All of KIN 160, KIN 262.",Indigenous Health and Wellness
kin-471,KIN 471,Work with an inter-professional health team to assess and rehabilitate neurological balance and mobility deficits. Students will assist in the delivery of exercise-based rehabilitation at the Physical Therapy Rehabilitation Clinic and the BC Brain Well Program. Restricted to students in the BKIN program with third- or fourth-year standing. Pass/Fail. Corequisite: KIN 320 and KIN 411.,Exercise Management of Chronic Neurological Balance and Mobility Conditions
kin-473,KIN 473,"Work in a team-based primary care setting with patients focusing on exercise prescription and program delivery under the clinical care of family physicians, dietician, practice support coaches, and kinesiologists. Restricted to students in the BKIN program with fourth-year standing. Pass/Fail. Prerequisites: KIN 320 and KIN 335.",Kinesiology Field Work in Primary Care Medicine
kin-475,KIN 475,"Gain hands-on experience working with members of the Physical Activity Research Centre at the Blusson Spinal Cord Centre. Apply skills in exercise testing, prescription, and physical activity counselling. Restricted to students in the BKIN program with third- or fourth-year standing. Pass/Fail. Prerequisite: KIN 320 (KIN 351 strongly recommended).",Physical Activity Counselling and Prescription for People with Spinal Cord Injury
kin-479,KIN 479,"Training in research methods, computational skills, and scientific dissemination related to neuromechanics research in Kinesiology. Students will learn the principles underlying scientific communication and apply these principles in the form of an oral dissemination of scientific results. Restricted to students in the BKIN program with third- or fourth-year standing. Pass/Fail. Prerequisites: Two of KIN 310, KIN 311, KIN 313, KIN 316, KIN 411, KIN 413, KIN 415, KIN 419.",Scientific Communication and Research Skills in Neuromechanical Kinesiology
korn-100,KORN 100,An introduction to the grammar and syntax of modern spoken and written Korean. Credit will be granted for only one of KORN 100 or KORN 102.,Basic Korean I
korn-101,KORN 101,Continuation of KORN 100. Credit will be granted for only one of KORN 101 or KORN 102. Recommended pre-requisite: KORN 100.,Basic Korean II
korn-102,KORN 102,"An introduction to the grammar and syntax of modern spoken and written Korean. As of 2011W, credit will be granted for only one of KORN 100/101 or KORN 102.",Basic Korean
korn-200,KORN 200,"Reading and writing of modern colloquial Korean at an intermediate level. As of 2011W, credit will be granted for only one of KORN 201/202 or KORN 200. Recommended pre-requisites: one of KORN 101, KORN 102.",Intermediate Korean
laso-204,LASO 204,"Ideas, concepts, and frameworks for thinking about the nature of law and legal processes in both Canadian and global contexts.",Introduction to Law and Society
latn-101,LATN 101,"Classical Latin, Part I.",Beginning Latin I
law-200,LAW 200,Critical examination of the history and legacy of colonial legal orders in Canada. This course is compulsory for students who commence their Juris Doctor degree in September 2020 or later. This course is not eligible for Credit/D/Fail grading.,Indigenous Settler Legal Relations
law-211,LAW 211,Historical development; formation and enforceability of contracts; parties; contractual terms; changes of circumstances; remedies for breach. This course is not eligible for Credit/D/Fail grading.,Contracts
law-221,LAW 221,Bases of criminal responsibility; principles and objectives of the criminal law and procedure; pre-trial procedure. This course is not eligible for Credit/D/Fail grading.,Criminal Law and Procedure
law-231,LAW 231,"The legal concept of ownership and its changing nature and application, including equitable principles, the acquisition and transfer of interests, the regulation of use, Aboriginal title, and statute-based systems for registering interests in land. This course is not eligible for Credit/D/Fail grading.",Property Law
law-241,LAW 241,A study of the bases of civil liability for intentionally and accidentally caused harms. This course is not eligible for Credit/D/Fail grading.,Torts
law-271,LAW 271,"An introduction to the structure, powers, duties of and relationships among the various institutions and actors that comprise the Canadian state, the principles of statutory interpretation, and the Canadian Charter of Rights and Freedoms. This course is not eligible for Credit/D/Fail grading.",Introduction to Public Law and the Charter
law-281,LAW 281,Introduction to legal research and writing skills and the use of legal databases. This course is not eligible for Credit/D/Fail grading.,Legal Research and Writing
law-291,LAW 291,An overview of the unique constitutional status and rights of Aboriginal Peoples in Canada. This course is not eligible for Credit/D/Fail grading.,Aboriginal and Treaty Rights
law-300,LAW 300,Introduction to the basic principles of legal theory and critical perspectives on law. This course is not eligible for Credit/D/Fail grading.,Jurisprudence and Critical Perspectives
law-347,LAW 347,An examination of the principles of Canadian federalism. This course is not eligible for Credit/D/Fail grading.,Federalism
law-359,LAW 359,"The law relating to family relationships, including the law of marriage, divorce, maintenance, custody, matrimonial property, and related matters. Credit will only be granted for one of LAW 359 or LAW 559. This course is not eligible for Credit/D/Fail grading.",Family Law
law-372,LAW 372,"Study of the external control of public actors exercising statutory authority. Introduction to general principles of procedural and substantive judicial review, delegated authority and subordinate legislation, remedies, and administrative processes. Credit will be granted for only one of LAW 372 or LAW 509. This course is not eligible for Credit/D/Fail grading.",Administrative Law
law-380,LAW 380,Structured reflective exercises on the LAW 379 Externship experience.,Externship Reflection
law-400,LAW 400,Selected topics relating to procedural law and practice in criminal matters. This course is not eligible for Credit/D/Fail grading.,Advanced Criminal Procedure
law-407,LAW 407,A survey of the law and practice of income and capital gains taxes. Credit will be granted for only one of LAW 407 or LAW 506. This course is not eligible for Credit/D/Fail grading.,Taxation
law-416,LAW 416,"Union-management relations; the collective bargaining process; the collective agreement, arbitration and conciliation procedure. The relationship between the union and its membership. [2-0] or [3-0] This course is not eligible for Credit/D/Fail grading.",Labour Law
law-422,LAW 422,"Copyright, patents, trademarks, industrial design, the protection of computer software, and torts such as passing-off and breach of confidence. Credit will only be granted for one of LAW 422 or LAW 570. This course is not eligible for Credit/D/Fail grading.",Intellectual Property
law-430,LAW 430,"Research using electronic databases, information systems, and non-legal databases relevant to the resolution of legal issues. This course is not eligible for Credit/D/Fail grading.",Advanced Legal Research
