id,code,description,name
elec-371,ELEC 371,"Theory and experiments involving instruments for general, orthopedic, cardiac and minimally invasive surgery as well as sensors for respiratory, cardiac, bioelectric, biochemical and nervous system measurement. Restricted to students admitted to the Biomedical Engineering option in Electrical Engineering and the Biomedical Engineering program. This course is cross-listed with BMEG 321. Credit will only be given for one of ELEC 371 or BMEG 321. Prerequisite: Either (a) all of MATH 265, MATH 267 or (b) MATH 256; and either (a) all of ELEC 202, ELEC 292 or (b) all of BMEG 220, BMEG 257. Equivalency: BMEG 321 This course is not eligible for Credit/D/Fail grading.",Biomedical Engineering Instrumentation
elec-391,ELEC 391,"Introduction to project management. Problem definition. Design principles and practices. Implementation techniques including circuit design, software design, solid modelling, PCBs, assembling, and packaging. Testing and evaluation. Effective presentations. Prerequisite: One of CPEN 291, ELEC 291, ELEC 292 and two of ELEC 301, ELEC 341, ELEC 311, ELEC 342. This course is not eligible for Credit/D/Fail grading.",Electrical Engineering Design Studio II
elec-400,ELEC 400,Lectures or projects on subjects of current interest. This course is not eligible for Credit/D/Fail grading.,Topics in Electrical Engineering
elec-401,ELEC 401,"Design and analysis of analog integrated circuits, with emphasis on CMOS design techniques. Gain stages, opamp design, frequency compensation, oscillators, A/D, D/A converters, PLL, DLL. Prerequisite: One of ELEC 301, ELEC 302. This course is not eligible for Credit/D/Fail grading.",Analog CMOS Integrated Circuit Design
elec-402,ELEC 402,"Static CMOS combinational logic circuits. Standard cells design and layout. Memory element (flip-flop and latch) design. Dynamic logic families. Synchronous logic and timing analysis. Power, scaling, and industry trends. Verification. VHDL/Verilog design, layout and synthesis project using CAD tools. Prerequisite: CPEN 311. This course is not eligible for Credit/D/Fail grading.",Introduction to VLSI Systems
elec-403,ELEC 403,"Logical effort. Noise in digital systems. Low power techniques. Power distribution. SRAM and DRAM design. Non-volatile memory technologies. High speed adder, multiplier and divider design. Clock Trees. Synchronization and FIFO. Scaling, and industry trends. High-speed circuit design and layout project. Prerequisite: ELEC 402. This course is not eligible for Credit/D/Fail grading.",Advanced Digital VLSI Systems
elec-404,ELEC 404,"Introduction to radio-frequency (RF) communication systems; matching networks, transceiver architectures, low noise amplifiers, mixers, oscillators, etc. Prerequisite: ELEC 221. Corequisite: ELEC 401. This course is not eligible for Credit/D/Fail grading.",RF Integrated Circuits
elec-411,ELEC 411,"Basic antenna concepts; antennas for low, medium and high frequencies; terrestrial and satellite propagation links; environmental effects on electromagnetic radiation. Prerequisite: One of ELEC 311, PHYS 301, PHYS 354. This course is not eligible for Credit/D/Fail grading.",Antennas and Propagation
elec-412,ELEC 412,Planar dielectric waveguides; single mode optical fibers; integrated optics waveguides and devices; resonators; transfer matrix methods; optical communications links. This course is not eligible for Credit/D/Fail grading.,Optical Waveguides and Photonics
elec-413,ELEC 413,"An introduction to lasers and applications. Theory, modelling, fabrication and performance of semiconductor lasers. Optical communications links. This course is not eligible for Credit/D/Fail grading.",Semiconductor Lasers
elec-415,ELEC 415,"Physics of operation, and design and analysis of semiconductor devices of topical interest, e.g., solar cells, LEDs, high-speed MOSFETs, high-frequency HBTs, low-noise HEMTs. Prerequisite: One of ELEC 315, PHYS 304. This course is not eligible for Credit/D/Fail grading.","Semiconductor Devices: Physics, Design and Analysis"
elec-416,ELEC 416,"Theory and modelling techniques of 0-dimensional structures. Electronic, magnetic, and optical properties of quantum dots. Current and future applications of quantum dots including: single electron transistors, quantum dot lasers, optical detectors. This course is not eligible for Credit/D/Fail grading.",Quantum Dots and Device Applications
elec-421,ELEC 421,DSP fundamentals; image processing; signal representation; digital filtering; statistical estimation; DSP applications. Prerequisite: ELEC 221. This course is not eligible for Credit/D/Fail grading.,Digital Signal and Image Processing
elec-422,ELEC 422,"Data acquisition, time and frequency domain analysis, analog and discrete filter design, sampling theory, time-dependent processing, linear prediction, random signals, biomedical system modelling, and stability analysis; introduction to nonlinear systems. Prerequisite: All of ELEC 371, ELEC 341, ELEC 221 and one of CPSC 260, CPSC 259 and one of STAT 251, MATH 318, MATH 302, STAT 302. This course is not eligible for Credit/D/Fail grading.",Biosignals and Systems
elec-431,ELEC 431,"Review of probability theory, signals and noise; digital communication over Gaussian noise channels, optimal receiver design, modulation techniques and error performance calculations; measure of information, source coding, symbol and stream codes; channel coding, capacity, simple linear block codes; practical applications. Prerequisite: ELEC 221 and one of ELEC 321, MATH 302, MATH 318, STAT 251, STAT 302, STAT 357. This course is not eligible for Credit/D/Fail grading.",Communication Systems I
elec-432,ELEC 432,"Communication over bandlimited additive white Gaussian noise channels; power spectra of digitally modulated signals; intersymbol interference; cyclic, convolutional, low-density parity check and turbo codes; trellis coded modulation; spread spectrum techniques; security; wireless communication systems and standards; practical applications. Prerequisite: ELEC 431. This course is not eligible for Credit/D/Fail grading.",Communication Systems II
elec-433,ELEC 433,"Design techniques, including Hamming, BCH, Reed-Solomon, LDPC and convolutional codes, ARQ techniques, and LFSR implementation of encoding-decoding algorithms. This course is not eligible for Credit/D/Fail grading.",Error Control Coding for Communications and Computers
elec-434,ELEC 434,"Wavelength division multiplexing, framing techniques, traffic grooming, virtual topology design, routing and wavelength assignment, protection and restoration, optical packet switching. Prerequisite: ELEC 221. This course is not eligible for Credit/D/Fail grading.",Introduction to Optical Networks
elec-441,ELEC 441,Relationships between system parameters and system responses for linear control systems. Design specifications for dynamic and steady-state performance and realization by use of feedback control. Robust design of PID controllers and multivariable controllers. Prerequisite: ELEC 341. This course is not eligible for Credit/D/Fail grading.,Control Systems
elec-442,ELEC 442,"Common manipulator configurations, actuator and sensor technology. Efficient representations and computational methods for real-time microprocessor-based implementation of robot control algorithms. Robot control methods, network equivalents, impedance control. Introduction to teleoperation implementation aspects. Prerequisite: PHYS 170. This course is not eligible for Credit/D/Fail grading.",Introduction to Robotics
elec-451,ELEC 451,"Power diodes, thyristors, transistors and FETs; analysis of idealized circuits with generalized loads; AC-DC, DC-DC, DC-AC, AC-AC converters, modulation techniques, gating circuits; practical design and applications. Prerequisite: One of ELEC 301, ELEC 344, ELEC 342. This course is not eligible for Credit/D/Fail grading.",Power Electronics
elec-452,ELEC 452,"Typical mechanical loads; dynamic and static characteristics and analysis of DC and AC drives; microprocessor-based controllers; commercial choices of drives for various applications. Prerequisite: One of ELEC 342, ELEC 343. This course is not eligible for Credit/D/Fail grading.",Industrial Drives
elec-453,ELEC 453,"Transmission and distribution; phasors, complex power; balanced/unbalanced three-phase operation; symmetrical components, sequence networks; voltage regulation; short circuit capacity; circuit breakers; transmission lines, series/shunt impedance; short, medium, and long line models. Prerequisite: ELEC 342. This course is not eligible for Credit/D/Fail grading.",Power System Analysis
elec-454,ELEC 454,"Power system monitoring/control; large networks; automatic generation control; optimum power flow calculations; traveling wave transmission lines; EMTP and MATLAB programs for transients, short-circuit, and transient stability analysis. Prerequisite: ELEC 453. This course is not eligible for Credit/D/Fail grading.",Power System Analysis II
elec-455,ELEC 455,"Analysis of disturbances, security of power systems, cascading and blackouts; role and impact of protection; transducers and measuring elements; protection of transmission and distribution systems; protection of generators, substation equipment, special protection systems and relays. Prerequisite: All of ELEC 453, ELEC 342. This course is not eligible for Credit/D/Fail grading.",Power Systems Protection
elec-456,ELEC 456,Principles; acceptable regions of operation; energy management systems; load flow methods; static and dynamic security; contingency analysis; transient and voltage stability; online stability assessment. This course is not eligible for Credit/D/Fail grading.,Decision Support Methods in Power Systems Operation
elec-457,ELEC 457,"Application of linear and nonlinear optimization methods in power systems; constrained optimization; optimal power flow; economic dispatch; electricity market; local prices for active and reactive power; security-constrained OPF; state estimation, reliability analysis. This course is not eligible for Credit/D/Fail grading.",Optimization of Power System Operation
elec-461,ELEC 461,"Topics of special importance to understanding and designing electronic devices in which quantum effects and the discrete nature of matter become important. Prerequisite: One of CHEM 312, ELEC 315, PHYS 250, PHYS 304. Corequisite: One of APSC 201, MTRL 478. This course is not eligible for Credit/D/Fail grading.",Nanotechnology in Electronics
elec-462,ELEC 462,"The mechanisms, design, fabrication, and testing of microsensors, actuators, and microelectromechanical systems (MEMS). This course is not eligible for Credit/D/Fail grading.",Sensors and Actuators in Microsystems
elec-463,ELEC 463,Microfabrication methods and nanofabrication techniques. Imaging and characterization of micro and nanostructures. Recommended Prerequisite: ELEC 315. This course is not eligible for Credit/D/Fail grading.,Micro/Nanofabrication and Instrumentation Laboratory
elec-464,ELEC 464,"Examples of nature's fabrication methods, sensors, actuators, energy harvesting, signaling and information processing, and comparisons with artificial methods. This course is not eligible for Credit/D/Fail grading.",Nanotechnology and Nature
elec-465,ELEC 465,"Structured modelling and design practices; multiphysics at microscales; physical limitations in MEMS; interface with electronics; behavioural modelling languages for mixed analog-digital system design. Credit will only be given for one of ELEC 465, or EECE 581. This course is not eligible for Credit/D/Fail grading.",Microsystems Design
elec-471,ELEC 471,"Physical principles of ultrasound, magnetic resonance, computed tomography, X-ray projection imaging and molecular imaging in medical imaging for diagnostics, therapeutics, and interventions. Prerequisite: All of ELEC 371, ELEC 341, ELEC 311, ELEC 221. Equivalency: BMEG420 This course is not eligible for Credit/D/Fail grading.",Medical Imaging
elec-472,ELEC 472,"Design of mechatronic systems to measure and manipulate biological materials and processes; compliant structures; bioelectronic circuits; biomedical embedded systems and BioMEMS. Example applications from clinical medicine and biomedical research. Credit will be granted for only one of MECH 423 or EECE 472. Prerequisite: All of ELEC 201, ELEC 202, CPEN 211, ELEC 341. This course is not eligible for Credit/D/Fail grading.",Biomechatronics
elec-473,ELEC 473,"Principles of sensors, actuators, microfluidics, biotechnology and nanotechnology, with applications in probing, detection, assaying and drug delivery. This course is not eligible for Credit/D/Fail grading.",Biological Micro-Electro-Mechanical Systems
elec-474,ELEC 474,"Lens theory, light sources and detectors, image resolution and contrast, tissue absorption and scattering, fluorescence, microscopy, spectroscopy, optical imaging systems, and their applications to life sciences and medicine. This course is not eligible for Credit/D/Fail grading.",Biophotonics
elec-481,ELEC 481,"Time-money relationships; economic analysis of alternatives including the effects of interest rates, inflation, depreciation, taxation and uncertainty; cost estimation and budgeting; financial analysis of engineering operations. This course is not eligible for Credit/D/Fail grading.",Economic Analysis of Engineering Projects
elec-491,ELEC 491,"Design, analysis, and implementation of solutions in response to a real-world electrical engineering problem, provided by industry, research laboratories, or other suitable entities. Includes coverage of topics such as project management. Prerequisite: ELEC 391. This course is not eligible for Credit/D/Fail grading.",Electrical Engineering Capstone Design Project
elec-494,ELEC 494,"Design, analysis, and implementation of solutions in response to a real world biomedical engineering problem, provided by industry, research laboratories, or other suitable entities. Includes coverage of topics such as project management. Prerequisite: ELEC 391. This course is not eligible for Credit/D/Fail grading.",Biomedical Engineering Capstone Design Project
engl-100,ENGL 100,A writing-intensive introduction to language and literary studies through the exploration of texts in their critical and theoretical contexts. Fulfills the first-year component of the Faculty of Arts Writing and Research Requirement. Open only to students in the Faculty of Arts. Recommended for students intending to become English majors. Essays are required. This course is not eligible for Credit/D/Fail grading.,Reading and Writing about Language and Literatures
engl-110,ENGL 110,"Study of selected examples of literary and cultural expression: examples may include poetry, fiction, drama, life narratives, essays, graphic novels, screenplays, and narrative adaptations in film and other media. Essays are required. This course is not eligible for Credit/D/Fail grading.",Approaches to Literature and Culture
engl-111,ENGL 111,"Study of selected communication genres from a language-based perspective: examples may include non-fiction, science writing, business discourse, journalism, language of the internet, podcasts, and other media. Essays are required. This course is not eligible for Credit/D/Fail grading.",Approaches to Language and Communication
engl-200,ENGL 200,"A collaboratively-taught exploration and application of key scholarly, theoretical and critical approaches informing the study of literatures in English. For ENGL courses at the 200- or 300- level, prior completion of at least one 100- level ENGL course is recommended. This course is not eligible for Credit/D/Fail grading.",Principles of Literary Studies
engl-220,ENGL 220,"A survey of prose, poetry and drama to the 18th Century. For ENGL courses at the 200- or 300- level, prior completion of at least one 100- level ENGL course is recommended.",Literature in English to the 18th Century
engl-222,ENGL 222,"The major types of Canadian writing: fiction, poetry, non-fictional prose, and drama. For ENGL courses at the 200- or 300- level, prior completion of at least one 100- level ENGL course is recommended.",Literature in Canada
engl-223,ENGL 223,"The major types of American writing: fiction, poetry, drama and non-fictional prose. For ENGL courses at the 200- or 300- level, prior completion of at least one 100- level ENGL course is recommended.",Literature in the United States
engl-225,ENGL 225,"Principles, methods, and resources for reading poetry. For ENGL courses at the 200- or 300- level, prior completion of at least one 100- level ENGL course is recommended.",Poetry
engl-227,ENGL 227,"Principles, methods and resources for reading the novel and the short story. For ENGL courses at the 200- or 300- level, prior completion of at least one 100- level ENGL course is recommended.",Prose Fiction
engl-229,ENGL 229,"Consult Department's website for current year's offerings. For ENGL courses at the 200- or 300- level, prior completion of at least one 100- level ENGL course is recommended. This course is not eligible for Credit/D/Fail grading.",Topics in the Study of Language and/or Rhetoric
engl-231,ENGL 231,"A study of cultural expression in contemporary indigenous contexts. For ENGL courses at the 200- or 300- level, prior completion of at least one 100- level ENGL course is recommended.",Introduction to Indigenous Literatures
engl-232,ENGL 232,"Approaches to the study of media: philosophical; technological; cultural; theoretical. For ENGL courses at the 200- or 300- level, prior completion of at least one 100- level ENGL course is recommended.",Approaches to Media Studies
engl-242,ENGL 242,"History, genres, and scholarly study of writing for children and adolescents. For ENGL courses at the 200- or 300- level, prior completion of at least one 100- level ENGL course is recommended.",Introduction to Children's and Young Adult Literature
engl-243,ENGL 243,"Genres and sub-genres of speculative fiction, such as science fiction and fantasy, alternate history, dystopian and post-apocalyptic narrative, and slipstream, as well as the intersections among them. For ENGL courses at the 200- or 300- level, prior completion of at least one 100- level ENGL course is recommended.",Speculative Fiction
engl-244,ENGL 244,"Literary, critical, and/or pop-culture texts about environmentalism and ecology. For ENGL courses at the 200- or 300- level, prior completion of at least one 100- level ENGL course is recommended.",Environment and Literature
engl-245,ENGL 245,"Introduction to the critical study of comics and graphic media. For ENGL courses at the 200- or 300- level, prior completion of at least one 100- level ENGL course is recommended.",Comics and Graphic Media
engl-246,ENGL 246,"Approaches to the study of the relationships between literature and film. For ENGL courses at the 200- or 300- level, prior completion of at least one 100- level ENGL course is recommended.",Literature and Film
engl-247,ENGL 247,"Introduction to methods and practices of television studies, with emphasis on the use of literary approaches to televisual narrative. For ENGL courses at the 200- or 300- level, prior completion of at least one 100- level ENGL course is recommended.",Television Studies
engl-248,ENGL 248,"Thematic and generic approaches to mystery, crime, and detective writing in English, primarily short-fiction and novels; may also include comics, radio, film, and television. For ENGL courses at the 200- or 300- level, prior completion of at least one 100- level ENGL course is recommended.",Mystery and Detective Fiction
engl-300,ENGL 300,"Analysis of theoretical methods and critical approaches practiced in the discipline of English studies. Required of all students in the English Honours Literature and Language & Literature programs. For ENGL courses at the 200- or 300- level, prior completion of at least one 100- level ENGL course is recommended. This course is not eligible for Credit/D/Fail grading.",Introduction to Critical Theory
engl-301,ENGL 301,"Study of the principles of written communication in general business and professional activities, and practice in the preparation of abstracts, proposals, reports, and correspondence. Not for credit towards the English Major or Minor. For ENGL courses at the 200- or 300- level, prior completion of at least one 100- level ENGL course is recommended.",Technical Writing
engl-309,ENGL 309,"Exploration of the persuasive dimension of discourse practices in science, technology, and medicine. For ENGL courses at the 200- or 300- level, prior completion of at least one 100- level ENGL course is recommended.","Rhetoric of Science, Technology, and Medicine"
engl-310,ENGL 310,"Introduction to classical rhetoric with attention to the analysis of present-day texts. For ENGL courses at the 200- or 300- level, prior completion of at least one 100- level ENGL course is recommended.",History and Theory of Rhetoric: Classical Rhetoric
engl-312,ENGL 312,"Introduction to theories of language and culture, and to techniques for analysing discourses in their social contexts. For ENGL courses at the 200- or 300- level, prior completion of at least one 100- level ENGL course is recommended.",Discourse and Society
engl-318,ENGL 318,"Principles of language change and language typology. The development of the English language from its Indo-European origins to the end of the Anglo-Saxon period. For ENGL courses at the 200- or 300- level, prior completion of at least one 100- level ENGL course is recommended.",History of the English Language: Early History
engl-319,ENGL 319,"Principles of language change. The development and spread of the English language from the Norman Conquest to the Modern English period. Prerequisite: Knowledge of the International Phonetic Alphabet (via ENGL 318, ENGL 330 or the equivalent). Recommended: ENGL 318.",History of the English Language: Later History
engl-321,ENGL 321,"Descriptive approaches to the English language. For ENGL courses at the 200- or 300- level, prior completion of at least one 100- level ENGL course is recommended.",English Grammar and Usage
engl-322,ENGL 322,"Application of linguistic theory and method to stylistic analysis. For ENGL courses at the 200- or 300- level, prior completion of at least one 100- level ENGL course is recommended.",Stylistics
engl-323,ENGL 323,"Study of geographical, social, and/or urban dialects of English. For ENGL courses at the 200- or 300- level, prior completion of at least one 100- level ENGL course is recommended.",Varieties of English
engl-327,ENGL 327,"Interpretation of linguistic usages through cognitive concepts. For ENGL courses at the 200- or 300- level, prior completion of at least one 100- level ENGL course is recommended.",Cognitive Approaches to the Study of Meaning
engl-328,ENGL 328,"Exploration of the concepts underlying figurative language (in vocabulary as well as in grammar), using data from both colloquial and literary language. For ENGL courses at the 200- or 300- level, prior completion of at least one 100- level ENGL course is recommended.","Metaphor, Language and Thought"
engl-330,ENGL 330,"An introduction to phonology, morphology, and lexical semantics. For ENGL courses at the 200- or 300- level, prior completion of at least one 100- level ENGL course is recommended.",The Structure of Modern English: Sounds and Words
engl-331,ENGL 331,"An introduction to syntax, pragmatics, and sentence semantics. For ENGL courses at the 200- or 300- level, prior completion of at least one 100- level ENGL course is recommended.",The Structure of Modern English: Sentences and Their Uses
engl-332,ENGL 332,"History of media and technological change; literary, rhetorical, or linguistic methods of inquiry. For ENGL courses at the 200- or 300- level, prior completion of at least one 100- level ENGL course is recommended.",Approaches to Media History
engl-333,ENGL 333,"Survey of development of text technologies (such as manuscripts, printed books, new media forms), through historical, cultural, and theoretical frameworks. Consult department website for current year's offerings. Credit granted for up to 6 credits of ENGL 333 and 419. For ENGL courses at the 200- or 300- level, prior completion of at least one 100- level ENGL course is recommended.",History of the Book
engl-342,ENGL 342,"Old English vocabulary, grammar, and translation, with readings in poetry and prose. Credit will be granted for only one of ENGL 340 and ENGL 342. For ENGL courses at the 200- or 300- level, prior completion of at least one 100- level ENGL course is recommended.",Introduction to Old English
engl-343,ENGL 343,"Readings in the literature of early medieval (pre-1200) Britain and its neighbours, in modern English translation. May encompass multiple genres and contexts. Consult department website for current year's offerings. For ENGL courses at the 200- or 300- level, prior completion of at least one 100- level ENGL course is recommended.",Anglo-Saxon and Early Medieval Literature
engl-344,ENGL 344,"May encompass multiple genres and contexts. Consult department website for current year's offerings. For ENGL courses at the 200- or 300- level, prior completion of at least one 100- level ENGL course is recommended.",Middle English Literature
engl-346,ENGL 346,A detailed study of Chaucer's major works.,Chaucer
envr-200,ENVR 200,"Seminars and field trips introducing the major global, regional, and local environmental issues facing human societies. [3-0-0] Prerequisite: Open to all students with second-year, or higher, standing.",Introduction to Environmental Science
envr-300,ENVR 300,"Environmental research. Students investigate research methodologies and reporting in a range of scientific disciplines and fields. [3-0-0] Prerequisite: Open to all students with third-year, or higher, standing in the Faculty of Science.",Introduction to Research in Environmental Science
