id,code,description,name
adhe-327,ADHE 327,"Planning, conducting and evaluating instruction for adults. Consideration is given to different beliefs and ways of thinking about teaching. [3-0-0]",Teaching Adults
adhe-328,ADHE 328,"The history, roles, and activities of institutions in the field of adult education. Institutions in Canada, Great Britain, and the United States are emphasized, and some experiences in other countries are examined. [3-0-0]",Institutions of Adult Education
adhe-329,ADHE 329,"Organization and administration of adult education events such as short courses, seminars, workshops, conferences and institutes. [3-0-0]","Developing Short Courses, Workshops and Seminars"
adhe-330,ADHE 330,"Community based adult education with particular emphasis on the application of knowledge of the social, economic, cultural and political environment in developing and conducting adult education programs with an for individuals and groups. [2-3-0]",The Community Practice of Adult Education
adhe-412,ADHE 412,"Survey of adult education theory and practice in Canada and the world. The focus is on the purpose and participation in, adult education, characteristics of learners, and the training of adult educators. [3-0-0; 3-0-0]",An Overview of Adult Education
amne-101,AMNE 101,"Greek and Latin roots of English vocabulary and grammar, with an introduction to language history and Greek and Roman culture. Credit will be granted for only one of CLST_V 101 or AMNE_V 101. Equivalency: CLST _V 101",Greek and Latin Roots of English
amne-151,AMNE 151,Greek and Roman mythology and its interpretation. Emphasis on ancient texts read in English translation. Credit will be granted for only one of CLST_V 105 or AMNE_V 151. Equivalency: CLST _V 105,Greek and Roman Mythology
amne-170,AMNE 170,"The rise of civilizations, cultural interconnections, and power dynamics in the ancient Middle East (including Egypt), Greece, and Rome (10,000 BCE - 300 CE). Archaeological methods and interpretation, and analysis of ancient artifacts in UBC collections. Credit will be granted for only one of CNRS_V 104 or AMNE_V 170. Equivalency: CNRS _V 104","Temples, Tombs, and Tyrants: The Archaeology of the Middle East, Greece, and Rome"
amne-216,AMNE 216,A survey of the ancient Roman world from the foundation of the city to the death of Constantine. Credit will be granted for only one of CLST_V 232 or AMNE_V 216. Equivalency: CLST _V 232,Ancient Rome
amne-251,AMNE 251,"An introduction to the world of Near Eastern mythology, from the Gilgamesh Epic to the Book of Genesis and beyond. Credit will be granted for only one of RELG_V 201 or AMNE_V 251. Equivalency: RELG _V 201",Near Eastern and Biblical Mythology
amne-260,AMNE 260,"An introduction to the scriptures of Judaism, Christianity, and Islam. Credit will be granted for only one of RELG_V 203 or AMNE_V 260. Equivalency: RELG_V 203",Scriptures of the Near East
amne-301,AMNE 301,"Acquaints the student with the Greek and Latin elements from which most specialized terms of modern medicine are constructed. Intended primarily for students planning to enter the medical, pharmaceutical, or biological sciences. Credit will be granted for only one of CLST_V 301 or AMNE_V 301. Equivalency: CLST_V 301",The Technical Terms of Medicine and Biological Science
amne-306,AMNE 306,"The origins, achievements, and social impacts of applied technology in the Greek and Roman world from the Bronze Age to Late Antiquity (c. 1500 BCE - 400 CE), with special attention to archaeological evidence. Credit will be granted for only one of CLST_V 306 or AMNE_V 306. Equivalency: CLST_V 306",Ancient Technology: Greece and Rome
amne-341,AMNE 341,"An exploration of the Bible's dark side, with emphasis on texts that center on sex, deceit, and murder. Credit will be granted for only one of RELG_V 307 or AMNE_V 341. Equivalency: RELG _V 307","Sex, Lies, and Violence in the Hebrew Bible"
amne-351,AMNE 351,"A survey of the religious beliefs, cults, and religious institutions in Pharaonic Egypt. Credit will be granted for only one of NEST_V 312 or AMNE_V 351. Equivalency: NEST _V 312",Religion in Ancient Egypt
amne-371,AMNE 371,"The material remains of the ancient Egyptians from monumental tombs and temples to the artifacts of daily life; the development of Egyptian civilization from the rise of the first rulers to its incorporation into the Roman Empire. Credit will be granted for only one of NEST_V 304, AMNE_V 371 or ARTH_V 325. Equivalency: ARTH_V 325 or NEST_V 304",Ancient Egypt: The Archaeology of the Land of the Pharaohs
amne-377,AMNE 377,"The visual culture of the ancient Roman world from the 8th century BCE to the 4th century CE. Credit will be granted for only one of CLST_V 332, AMNE_V 377 or ARTH_V 332. Equivalency: ARTH_V 332 or CLST_V 332",Roman Art and Architecture
anth-100,ANTH 100,"Basic concepts and methods of anthropology; culture and race; comparative study of social systems, religion, symbolism, art, and other institutions. Examples are drawn from a variety of cultures.",Introduction to Cultural Anthropology
anth-201,ANTH 201,"Anthropological critiques of racism, colonialism and ongoing structural inequalities.","Culture, Race and Inequality"
anth-203,ANTH 203,"Illicit and/or licit drugs through historical, political, cultural and societal examples.",Anthropology of Drugs
anth-205,ANTH 205,Analysis of insurrections and revolutions from a comparative perspective.,The Anthropology of Insurrections and Revolution
anth-206,ANTH 206,Anthropological approaches to supernatural beliefs in both traditional and contemporary societies.,"Witches, Vampires, and Zombies: Anthropology of the Supernatural"
anth-210,ANTH 210,"An anthropological exploration of how the collection, cultivation and consumption of food shapes human society and culture. This course is not eligible for Credit/D/Fail grading.",Eating Culture
anth-213,ANTH 213,An anthropological exploration of how understandings of sex and gender are culturally and historically shaped.,"Sex, Gender, and Culture"
anth-217,ANTH 217,"The study of communication; the relation between communication and its cultural context with emphasis on verbal and non-verbal communication, cross-cultural communication, and cultural differences in the use of oral, literate, and electronic media.",Culture and Communication
anth-220,ANTH 220,Anthropological perspectives on contemporary Indigenous issues in British Columbia.,Contemporary Indigenous Issues in British Columbia
anth-227,ANTH 227,"An examination of health and illness, in their social and cultural contexts.",Introduction to Medical Anthropology
anth-300,ANTH 300,Contemporary approaches to society and culture in anthropology. Prerequisite: ANTH 200 is recommended.,Contemporary Anthropological Theory
anth-303,ANTH 303,A specialized study of ethnographic and theoretical problems in one area. Different culture areas or regions may be selected each term. Consult the Department for this year's offerings.,Ethnography of Special Areas
anth-309,ANTH 309,"Ethnographic engagement with lives of people in and from the Himalayan region: including parts of Bhutan, China, India, Nepal, Pakistan; Tibetan cultural zones traversing these countries; and diasporas.",Ethnography of the Himalaya: Diversity & Development
anth-312,ANTH 312,"Ethnographic and theoretical approaches to gender and sexuality, in cross-cultural context.",Anthropology of Gender & Sexuality
anth-317,ANTH 317,A survey of the ethnographic uses of language data and the techniques of linguistic analysis.,Linguistic Anthropology
anth-331,ANTH 331,"Anthropological perspectives on art, aesthetics, and expressive culture.","Art, Aesthetics and Anthropology"
anth-332,ANTH 332,"An ethnographic perspective on the dynamics of oral tradition in various oral and literate cultures; the characteristics and roles of oral genres including folktale, genealogy, oral history, autobiography, and myth in these societies; and the relationship between orality and literacy.",Oral Tradition
anth-341,ANTH 341,"Museums, galleries, monuments, and other cultural institutions' relations to our perception of history and geography.","Museums, Heritage and Memory"
anth-378,ANTH 378,"Analysis of contemporary mass media and of the anthropological use of media (photography, film, digital audio and video, etc.).",Anthropology of Media
anth-400,ANTH 400,The development of anthropological theory and practice in institutional contexts.,History of Anthropology
anth-495,ANTH 495,An intensive examination of selected topics in Anthropology. Consult the Department for this year's offerings.,Advanced Studies in Anthropology
apbi-200,APBI 200,"Physical, chemical and biological properties of soils; soil formation, classification, use and conservation. There are no prerequisites for this course, but background in Biology 12, Chemistry 12, and Physics 12 (or first-year university-level) is strongly advised. [3-2]",Introduction to Soil Science
apbi-214,APBI 214,"History, philosophy, and current practices of animal shelters and companion animal support services, with a focus on emerging issues from a One Health/One Welfare perspective. Prerequisite: Second-year standing or higher.",Animal Sheltering and Companion Animal Support Services
apbi-244,APBI 244,"Physical principles underlying weather and climates. Thermal, moisture and wind climates from the scale of plants and animals to the globe. Daily weather systems and climate change. Credit will be granted for only one of GEOS (or GEOB) 200, GEOS (or GEOB) 204 or APBI 244. Equivalency: GEOS (OR GEOB) 200",Atmospheric Environments
apbi-290,APBI 290,Analysis and interpretation of current issues in applied biology. Topics will vary from year to year.,Introductory Topics in Applied Biology
apbi-312,APBI 312,"Reproductive and digestive physiology, and current technologies applied to these systems in domestic and wild animals. Prerequisite: One of BIOL 204, BIOL 260. 3rd year standing.",Reproductive and Digestive Physiology
apbi-314,APBI 314,"Contemporary use of animals for food production, companionship, recreation and science; social and ethical issues concerning human impacts on animals; animals in human culture; protection of animals by society and the law. Prerequisite: At least third-year standing in any faculty.",Animals and Society
apbi-315,APBI 315,"Scientific assessment of animal well-being, ethical concepts applied to animal use, and animal welfare issues arising in agriculture, biomedical research and other areas. Credit will be granted for only one of APBI 315, ANSC 515, or AANB 515. [1-0-3] Prerequisite: At least third-year standing in any faculty.",Animal Welfare and the Ethics of Animal Use
apbi-316,APBI 316,"Anatomy, physiology, reproduction, nutrition of the horse; common disease pathology, prevention and treatments; equine behaviour. [3-0]","Equine Biology, Health and Welfare"
apbi-428,APBI 428,Development and implementation of multi-disciplinary pest management programs in agricultural crops. [3-2] Prerequisite: BIOL 121.,Integrated Pest Management
apbi-490,APBI 490,Analysis and interpretation of current issues in applied biology. Prerequisite: 3rd year standing or higher.,Advanced Topics in Applied Biology
apsc-100,APSC 100,"An introduction to the engineering profession including: roles and responsibilities of the engineer, the engineering disciplines, sustainability, an introduction to the engineering design process, introduction and application of the relevant foundational scientific principles, prototyping, engineering graphics, technical communication, and engineering ethics. [2-2-0] Not eligible for Credit/D/Fail grading.",Introduction to Engineering I
apsc-101,APSC 101,"An introduction to the engineering profession including: the engineering design process, sustainability, prototype testing, introduction and application of the relevant foundational scientific principles, team functioning, engineering graphics, and technical communication. [2-2-0] Prerequisite: APSC 100. Not eligible for Credit/D/Fail grading.",Introduction to Engineering II
apsc-122,APSC 122,"Non-credit course designed to introduce students to Engineering. Information on the Faculty, the profession and the particular skills and type of work done by practising engineers in different disciplines. [1-0-0] Not eligible for Credit/D/Fail grading.",Introduction to Engineering
apsc-150,APSC 150,Application of scientific principles and technical knowledge to practical problems. Introduction to the engineering design process and to engineering graphics. [3-4-0] Not eligible for Credit/D/Fail grading.,Engineering Case Studies
apsc-151,APSC 151,"Orthographic projection, technical sketching, development of the ability to visualize in three dimensions. Standards and conventions of engineering drawing, graphical presentation of engineering data. Micro-computer-based graphics aids. Engineering geometry and the solution of space problems. [1-0-4] Not eligible for Credit/D/Fail grading.",Computer-Aided Engineering Graphics
apsc-160,APSC 160,"Analysis and simulation, laboratory data acquisition and processing, measurement interfaces, engineering tools, computer systems organization, programming languages. Credit will only be given for one of: APSC 160, CPSC 301, or EOSC 211. [3-2-0] Not eligible for Credit/D/Fail grading.",Introduction to Computation in Engineering Design
apsc-172,APSC 172,"Functions, limits, differentiation, applications of derivatives, integration, applications of definite integrals. [3-0-1] Not eligible for Credit/D/Fail grading.",Engineering Analysis I
apsc-173,APSC 173,"Integrals and transcendental functions, techniques of integration, applications of integration, polar coordinates, infinite sequences and series, vectors and the geometry of space, and partial derivatives. [3-0-1] Prerequisite: APSC 172. Not eligible for Credit/D/Fail grading.",Engineering Analysis II
apsc-176,APSC 176,"Purpose, audience, content, format, and tone are studied, as are team-based report writings and presentations. Community Service Learning projects are integrated into existing assignments. An LPI level 5 is required for registration. [2-0-2] Not eligible for Credit/D/Fail grading.",Engineering Communication
apsc-178,APSC 178,"Coulomb's law, electric field, Gauss' law, electric potential, conductors, capacitance, electric currents, resistance, DC circuits, magnetic fields and forces, sources of magnetic fields, electromagnetic induction, mechanical waves, electromagnetic waves, light propagation, geometrical optics. [4-0-2] Prerequisite: APSC 172. Corequisite: APSC 173. Not eligible for Credit/D/Fail grading.","Electricity, Magnetism, and Waves"
apsc-179,APSC 179,"Systems of linear equations, Gaussian elimination, engineering application of linear algebra, matrix operations, special matrices, determinants, vector space, orthogonality, eigenvalues and eigenvectors, linear transformation. [3-0-0]",Linear Algebra for Engineers
apsc-180,APSC 180,"Force vectors, Cartesian coordinate system, free body diagram, dot and cross products, forces equilibrium of particles, force and moment equilibrium of rigid bodies, analysis of trusses, frames and machines, friction, wedges, pulleys, and belts. Applications of linear algebra in statics. [3-0-2] Not eligible for Credit/D/Fail grading.",Statics
apsc-182,APSC 182,"Thermometry, states of matter and phase change, ideal and real gases, 1st law of thermodynamics, 2nd law of thermodynamics, liquids, solutions. [2-2*-2*] Not eligible for Credit/D/Fail grading.",Matter and Energy I
apsc-183,APSC 183,"Atomic structures and bonding, solid crystals, chemical equilibrium, reactions in gas phase and in aqueous solutions, acid-base and redox reactions, kinetics of chemical reactions, thermochemistry, electrochemistry. [2-2*-2*] Not eligible for Credit/D/Fail grading.",Matter and Energy II
apsc-201,APSC 201,"Written and oral communication in engineering. Report preparation, business correspondence, and oral presentation of technical material. Credit granted for only one of BMEG 201, CHBE 201, CIVL 203, CPEN 281, ELEC 281, IGEN 201, MANU 201, MECH 226, MTRL 201, or APSC 201. [3-0-0] Prerequisite: One of APSC 176, ENGL 110, ENGL 111, ENGL 112, ENGL 120, ENGL 121, WRDS 150. Not eligible for Credit/D/Fail grading.",Technical Communication
apsc-202,APSC 202,"Written and oral communication in business correspondence, engineering design methods, report preparation, and oral presentations of technical material. Restricted to students in second year of the Engineering Physics Program. [2-0-1] Prerequisite: One of APSC 176, ENGL 110, ENGL 111, ENGL 112, ENGL 120, ENGL 121. Corequisite: ENPH 259. Not eligible for Credit/D/Fail grading.",Technical Communication Engineering Physics I
apsc-203,APSC 203,"Continuation of written and oral communication in business correspondence, engineering design methods, report preparation and oral presentations of technical material. Restricted to students in second year of the Engineering Physics Program. [1-0-0] Prerequisite: APSC 202. Corequisite: ENPH 253. Not eligible for Credit/D/Fail grading.",Technical Communication Engineering Physics II
apsc-261,APSC 261,"The influence of technology on the social, political, economic, and environmental aspects of society. Subjects vary yearly (e.g., resources, energy, nuclear power, effects of technology on family, education, agriculture, international policy). [3-0-0]",Technology and Society I
apsc-262,APSC 262,"Continuation of APSC 261 or independent study of topics such as pollution, workplace health hazards, social impact of computers, problem solving, green revolution, technology in the third world, engineering ethics. [3-0-0] Not eligible for Credit/D/Fail grading.",Technology and Society II
apsc-263,APSC 263,"Environmental, economic, political, and social aspects of appropriate technologies in the developing world. Topics include infrastructure, trade and finance, transportation, energy, water access, communication, health, and gender. [3-0-0] Not eligible for Credit/D/Fail grading.",Technology and Development
apsc-278,APSC 278,"Atomic bonding; crystal structures and imperfections; properties of metals, ceramics, polymers, wood, concrete and fibre composite materials; selection of materials; corrosion; mechanical testing and heat treatment. [3-0-0] Not eligible for Credit/D/Fail grading.",Engineering Materials
apsc-279,APSC 279,"Laboratory component for APSC 278. Topics include atomic bonding; crystal structures and imperfections; material properties; selection, corrosion, and testing. [0-2*-0] Corequisite: APSC 278 may be taken. Not eligible for Credit/D/Fail grading.",Engineering Materials Laboratory
apsc-331,APSC 331,Intermediate-level engineering design project involving material in the curriculum of the Integrated Engineering program. For students in the Co-operative Education Program. [1-4-0] Not eligible for Credit/D/Fail grading.,Intermediate Engineering Design I
apsc-332,APSC 332,Continuation of APSC 331. Intermediate-level engineering design project for students in the Co-operative Education Program. [1-4-0] Prerequisite: APSC 331. Not eligible for Credit/D/Fail grading.,Intermediate Engineering Design II
apsc-364,APSC 364,"The role and function of common infrastructures, and the impact of various technological solutions on people, the economy, and the environment. Prerequisite: Third-year standing. Not eligible for Credit/D/Fail grading.",Applied Sustainability: UBC as a Living Laboratory
apsc-366,APSC 366,"An introduction to engineering for the non-specialist. A case-studies approach includes examples from sustainability-related technology, consumer products, structures, and energy conversion. [3-0-1]",The Art of the Possible: An Introduction to Engineering for Non-Engineers
apsc-367,APSC 367,"Interdisciplinary study of best practices, politics, and ethics of technical solutions to humanitarian assistance in Canada and abroad. Examines policies in aid and development contexts with emphasis on engineering applications. [3-0-0] Prerequisite: Restricted to students in Political Science, International Relations, or 3rd-year BASc. Credit granted for only one of POLI 371 or APSC 367. Equivalency: POLI 371. Not eligible for Credit/D/Fail grading.",Humanitarian Engineering: Politics and Practice
apsc-377,APSC 377,Evolution and contemporary significance of nuclear weapons and arms control policy and technology from scientific and humanities perspectives. Recommended prerequisite: third-year standing in BA/BSc or second-year in BASc. Credit granted for only one of APSC 377 or POLI 377. Equivalency: POLI 377.,Nuclear Weapons and Arms Control
apsc-380,APSC 380,"Introductory course for microcomputer applications in real-time or non-computational engineering. Topics: hardware, programming, input-output devices, transducers, analog/digital converters, case studies (e.g., digital controllers, sensor-based systems). [2-3*-2*] Restricted to non-Electrical/Computer Engineering students. Not eligible for Credit/D/Fail grading.",Introduction to Microcomputers
apsc-383,APSC 383,"Systematic approach and use of tools for prototyping. Integration of software, electronics, and physical components for innovation, product development, market identification, and problem solving. [3-0-0] Not eligible for Credit/D/Fail grading.",Prototyping
apsc-402,APSC 402,"Multi-disciplinary course examining and applying subject-specific knowledge through the lens of language and language sciences, focusing on themes of real-world importance. [3-0-0] Prerequisite: Fourth-year standing or instructor permission. Equivalency: ASTU402, FRST402, LFS 402, LLED402, PHAR402. Not eligible for Credit/D/Fail grading.",Living Language: Science and Society
apsc-440,APSC 440,"Management topics for technology-based industries: project management, marketing planning, product development and commercialization, quality management, teamwork. [3-0-0] Prerequisite: Fourth-year standing in Engineering. Not eligible for Credit/D/Fail grading.",Management Fundamentals for Technology-Based Product Marketing and Development
apsc-450,APSC 450,"Legislation affecting engineering practice; ethical principles and responsibilities. Management of engineering enterprises, labour relations, safety, and environmental legislation. Restricted to final-year engineering undergraduates. [2-0-0] Not eligible for Credit/D/Fail grading.",Professional Engineering Practice
apsc-461,APSC 461,"Introduction to engineering leadership concepts, theory, and practice: individual and cultural differences, service and management contexts, change management, conflict resolution, ethics, and core values. [3-0-0] Prerequisite: Completion of third year. Not eligible for Credit/D/Fail grading.",Global Engineering Leadership
apsc-462,APSC 462,International service learning (ISL) placement applying engineering leadership concepts by collaborating with community organizations on appropriate technology projects. Prerequisite: APSC 461 and registration with Go Global ISL program. Not eligible for Credit/D/Fail grading.,Global Engineering Leadership Practicum
apsc-486,APSC 486,"Teams (APSC 486 and COMM 466) create a business plan and prototype or engineering solution for a novel product, process, or component. [1-4-0; 1-4-0] Not eligible for Credit/D/Fail grading.",New Venture Design
arcl-103,ARCL 103,"A critical introductory overview to the discipline of archaeology, its functions and entanglements, and potential contributions and transformations for the future.",Introduction to Archaeology: Past perspectives and Future Promise
arcl-140,ARCL 140,The origin and evolution of the human lineage and the emergence of human biological and cultural traits with emphasis on the fossil record before the Pleistocene.,Bones: The Origins of Humanity
arcl-203,ARCL 203,Introduces the methods and principles applied in anthropological archaeology and cultural-historical research.,Archaeological Methods
arcl-228,ARCL 228,"The application of methods from biological anthropology and archaeology to the identification, recovery, and analysis of skeletal remains from crime scenes, mass disasters, and unexplained deaths.",Forensic Anthropology
arcl-235,ARCL 235,"How, when and why humans became dependent on cultivated foods and domestic animals and the methods used to document plant and animal domestication.","Taming the Wild: Animals, Alcohol and Agriculture"
arth-101,ARTH 101,"Drawing on examples from across history and around the world, this course deals with the role of the visual in society, culture, and everyday experience.",Ways of Seeing: Introduction to Visual Studies
arth-102,ARTH 102,Concepts and issues critical to the understanding of art and its histories in a global context.,Crisis and Contradiction in Art and the Built Environment
arth-227,ARTH 227,Select issues in 20th-century art and the visual and built environment.,What is Modern Art?
arth-230,ARTH 230,"Feminist art and visual culture, from the political activism of the feminist first wave to its intersections with present-day social justice movements.","Art & Feminism(s): Histories, Lineages, Legacies"
arth-253,ARTH 253,"Select built forms in Asia, such as temples, tombs, palaces, cities and gardens, and their relations to cultural, social and political systems.",Asian Architecture: Sacred and Urban Spaces
arth-262,ARTH 262,A survey of the artistic production by Indigenous peoples of North America from pre-contact times to the present.,Indigenous Arts of North America
arth-320,ARTH 320,"Role of visual art and culture within Catholic Spain and colonial Latin America is surveyed, with emphasis on transculturation from mudejar to mestizaje.",Entangled Worlds: Spain and Colonial Latin America (1500-1700)
